{
    "toolkit": "none",
    "tlsEncryption": "Tls",
    "hostname": "olivine-stream1.ccs.ornl.gov",
    "port": 30913,
    "amqpsUrl": "amqps://rabbit:rabbit@128.219.128.160:30671",
    "authentication": {
        "method": "username_password",
        "credentials": {
            "username": "rabbit",
            "password": "rabbit"
        }
    }
}
